{
  "input": "Googlep",
  "sessionToken": "0a1b2c3d-4e5f-6789-abcd-ef0123456789",
  "languageCode": "en",
  "regionCode": "US",
  "includedPrimaryTypes": [
    "cafe"
  ],
  "locationBias": {
    "circle": {
      "center": {
        "latitude": 7.2252,
        "longitude": -105.0676
      },
      "radius": 618.9
    }
  }
}